{
  "schema_version": 5,
  "name": "git-lfs",
  "description": "Git 大文件管理扩展，适合版本化图片、模型和其他大型资源，支持 HTTPS 与本地传输、克隆时还原文件及历史迁移。",
  "upstream": "https://github.com/git-lfs/git-lfs",
  "repository": "https://github.com/oheco/git-lfs",
  "maintainers": [
    {
      "github": "kdada",
      "name": "Guo Wei"
    }
  ],
  "license": "MIT",
  "notes": "需要 PATH 中有 Git，oo 会按依赖声明安装；安装后仍需在仓库执行 git lfs install --local 才会配置过滤器和 hooks。已有仓库可用 git lfs pull 下载并还原大文件，HTTPS 私有 CA 可通过 http.sslCAInfo 配置。SSH、凭据助手和自定义传输程序需自行提供；本地 Git 克隆仍需 --no-hardlinks，不要依赖 reflink 或 git lfs dedup 优化。",
  "latest": {
    "ohos-arm64": "3.8.0-ohos.1"
  },
  "versions": [
    {
      "version": "3.8.0-ohos.1",
      "upstream_version": "3.8.0",
      "dependencies": [
        {"name": "git", "constraint": "*"}
      ],
      "artifacts": {
        "ohos-arm64": {
          "url": "https://github.com/oheco/git-lfs/releases/download/v3.8.0-ohos.1/git-lfs-3.8.0-ohos.1-ohos-arm64.tar.gz",
          "sha256": "cd6570e3d0e4dfe84e2ad87cbcdd9267240a83aae29d1a30a491f6cf28da2331",
          "size": 5045936,
          "format": "tar.gz",
          "strip_components": 1,
          "binaries": {
            "git-lfs": "bin/git-lfs"
          },
          "launchers": [
            "git-lfs"
          ]
        }
      }
    }
  ]
}
