{
  "schema_version": 3,
  "name": "vscode-ripgrep",
  "package_manager": "npm",
  "package_name": "@vscode/ripgrep",
  "description": "在 Node.js 项目中调用 ripgrep 的包装库，自动加载配套平台命令包，适合为编辑器和开发工具提供文本搜索能力。",
  "upstream": "https://github.com/microsoft/vscode-ripgrep",
  "repository": "https://github.com/oheco/vscode-ripgrep",
  "maintainers": [
    {
      "github": "kdada",
      "name": "Guo Wei"
    }
  ],
  "license": "MIT",
  "latest": {
    "ohos-arm64": "1.18.0-ohos.2"
  },
  "versions": [
    {
      "version": "1.18.0-ohos.2",
      "upstream_version": "1.18.0",
      "npm_artifacts": {
        "url": "https://github.com/oheco/vscode-ripgrep/releases/download/v1.18.0-ohos.2/vscode-ripgrep-1.18.0-ohos.2.tgz",
        "sha256": "1c4f95ff79195e148cf77bac6f88bf7523a39a74d6015acf415f109ab80b9329",
        "size": 3210,
        "filename": "vscode-ripgrep-1.18.0-ohos.2.tgz",
        "package_json": {
          "name": "@vscode/ripgrep",
          "version": "1.18.0-ohos.2",
          "description": "A module for using ripgrep in a Node project",
          "type": "module",
          "main": "./lib/index.js",
          "types": "./lib/index.d.ts",
          "exports": {
            ".": {
              "types": "./lib/index.d.ts",
              "default": "./lib/index.js"
            }
          },
          "repository": {
            "type": "git",
            "url": "https://github.com/oheco/vscode-ripgrep"
          },
          "author": "Rob Lourens",
          "license": "MIT",
          "os": [
            "openharmony"
          ],
          "cpu": [
            "arm64"
          ],
          "dependencies": {
            "@vscode/ripgrep-openharmony-arm64": "1.18.0-ohos.2"
          }
        }
      }
    },
    {
      "version": "1.18.0-ohos.1",
      "upstream_version": "1.18.0",
      "npm_artifacts": {
        "url": "https://github.com/oheco/vscode-ripgrep/releases/download/v1.18.0-ohos.1/vscode-ripgrep-1.18.0-ohos.1.tgz",
        "sha256": "330b598d19ee95383cd55edf1c3714ef7780d421d7517e4704e406e7f9430945",
        "size": 3201,
        "filename": "vscode-ripgrep-1.18.0-ohos.1.tgz",
        "package_json": {
          "name": "@vscode/ripgrep",
          "version": "1.18.0-ohos.1",
          "description": "A module for using ripgrep in a Node project",
          "type": "module",
          "main": "./lib/index.js",
          "types": "./lib/index.d.ts",
          "exports": {
            ".": {
              "types": "./lib/index.d.ts",
              "default": "./lib/index.js"
            }
          },
          "repository": {
            "type": "git",
            "url": "https://github.com/oheco/vscode-ripgrep"
          },
          "author": "Rob Lourens",
          "license": "MIT",
          "os": [
            "openharmony"
          ],
          "cpu": [
            "arm64"
          ],
          "dependencies": {
            "@vscode/ripgrep-openharmony-arm64": "1.18.0-ohos.1"
          }
        }
      }
    }
  ],
  "notes": "在项目目录执行 oo install vscode-ripgrep -- 安装依赖，不带 -- 默认全局安装；需要 Node.js 24，会自动安装匹配的平台程序包。通过 @vscode/ripgrep 的 rgPath 获取路径，再用子进程调用搜索程序。它不创建独立的全局 rg 命令，终端直接搜索请安装 ripgrep。"
}
