{
  "schema_version": 3,
  "name": "vscode-ripgrep-openharmony-arm64",
  "package_manager": "npm",
  "package_name": "@vscode/ripgrep-openharmony-arm64",
  "description": "为 @vscode/ripgrep 提供 ripgrep 15.0.0 搜索程序及 PCRE2 10.45 正则支持，供 Node.js 工具执行递归文本搜索。",
  "upstream": "https://github.com/microsoft/vscode-ripgrep",
  "repository": "https://github.com/oheco/vscode-ripgrep",
  "maintainers": [
    {
      "github": "kdada",
      "name": "Guo Wei"
    }
  ],
  "license": "MIT",
  "latest": {
    "ohos-arm64": "1.18.0-ohos.2"
  },
  "versions": [
    {
      "version": "1.18.0-ohos.2",
      "upstream_version": "1.18.0",
      "npm_artifacts": {
        "url": "https://github.com/oheco/vscode-ripgrep/releases/download/v1.18.0-ohos.2/vscode-ripgrep-openharmony-arm64-1.18.0-ohos.2.tgz",
        "sha256": "38ff840887bdb7d6633243a66d5a4786ba7e809406622ae62f170bbdfa289edc",
        "size": 9454419,
        "filename": "vscode-ripgrep-openharmony-arm64-1.18.0-ohos.2.tgz",
        "package_json": {
          "name": "@vscode/ripgrep-openharmony-arm64",
          "version": "1.18.0-ohos.2",
          "description": "Signed HarmonyOS ARM64 ripgrep 15.0.0 with PCRE2 10.45 for @vscode/ripgrep",
          "repository": {
            "type": "git",
            "url": "https://github.com/oheco/vscode-ripgrep"
          },
          "license": "MIT",
          "os": [
            "openharmony"
          ],
          "cpu": [
            "arm64"
          ]
        }
      }
    },
    {
      "version": "1.18.0-ohos.1",
      "upstream_version": "1.18.0",
      "npm_artifacts": {
        "url": "https://github.com/oheco/vscode-ripgrep/releases/download/v1.18.0-ohos.1/vscode-ripgrep-openharmony-arm64-1.18.0-ohos.1.tgz",
        "sha256": "43f265b0e59ccd022f74929cbd146ffe14aebb80a552743ba30eb5dcf742d3c2",
        "size": 9353498,
        "filename": "vscode-ripgrep-openharmony-arm64-1.18.0-ohos.1.tgz",
        "package_json": {
          "name": "@vscode/ripgrep-openharmony-arm64",
          "version": "1.18.0-ohos.1",
          "description": "Signed HarmonyOS ARM64 ripgrep 15.0.0 with PCRE2 10.45 for @vscode/ripgrep",
          "repository": {
            "type": "git",
            "url": "https://github.com/oheco/vscode-ripgrep"
          },
          "license": "MIT",
          "os": [
            "openharmony"
          ],
          "cpu": [
            "arm64"
          ]
        }
      }
    }
  ],
  "notes": "通常由 @vscode/ripgrep 自动安装；单独作为项目依赖时执行 oo install vscode-ripgrep-openharmony-arm64 --，不带 -- 默认全局安装。需要 Node.js 24，程序路径宜通过 @vscode/ripgrep 的 rgPath 获取。此 npm 包不创建全局 rg 入口，只需终端命令时请安装 ripgrep。"
}
