{
  "schema_version": 3,
  "name": "koffi",
  "package_manager": "npm",
  "package_name": "koffi",
  "description": "Node.js 的 C 外部函数接口库，可调用动态库中的函数并处理结构体和回调，适合把现有 C 接口接入 JavaScript。",
  "upstream": "https://github.com/Koromix/rygel",
  "repository": "https://github.com/oheco/rygel",
  "maintainers": [
    {
      "github": "kdada",
      "name": "Guo Wei"
    }
  ],
  "license": "MIT",
  "latest": {
    "ohos-arm64": "3.1.1-ohos.1"
  },
  "versions": [
    {
      "version": "3.1.1-ohos.1",
      "upstream_version": "3.1.1",
      "npm_artifacts": {
        "url": "https://github.com/oheco/rygel/releases/download/koffi-v3.1.1-ohos.1/koffi-3.1.1-ohos.1.tgz",
        "sha256": "3e7236f2ada1698a398c82eb948f1537327813ce9e8abb46932ff8de3f96c925",
        "size": 632573,
        "filename": "koffi-3.1.1-ohos.1.tgz",
        "package_json": {
          "name": "koffi",
          "version": "3.1.1-ohos.1",
          "description": "Fast and easy-to-use dynamic C FFI (foreign function interface) for Node.js",
          "keywords": [
            "foreign",
            "function",
            "interface",
            "ffi",
            "binding",
            "c",
            "napi"
          ],
          "repository": {
            "type": "git",
            "url": "https://github.com/oheco/rygel",
            "directory": "src/koffi"
          },
          "homepage": "https://koffi.dev/",
          "author": {
            "name": "Niels Martignène",
            "email": "niels.martignene@protonmail.com",
            "url": "https://koromix.dev/"
          },
          "main": "./index.cjs",
          "module": "./index.js",
          "types": "./index.d.ts",
          "license": "MIT",
          "funding": "https://liberapay.com/Koromix",
          "type": "module",
          "os": [
            "openharmony"
          ],
          "cpu": [
            "arm64"
          ],
          "engines": {
            "node": ">=24"
          }
        }
      }
    }
  ],
  "notes": "作为项目依赖时，在项目目录执行 oo install koffi --，再用 require('koffi') 加载；不带 -- 默认全局安装。需要 Node.js 24，被调用的动态库需自行提供与鸿蒙兼容的实现。函数签名、结构体布局和回调必须与实际 C ABI 一致。"
}
